1,What is capital of gujrat?,4,Gandhinagar,Bharuch,Gandhinagar,surat,vadodara
2,do you like the ddit sesssional examination?,2,no,yes,no,,
3,describe your self in 2 or 4 word.,0,I am zerocool,,,,
4,do you have ever sent message in wrong group and then think that you have made big scene?,2,yes,yes,no,,
5,how do you find your junior technical commeety work?,4,awesome,poor,medium,good,awesome
6,tell one or two word about our portal!,0,awesome,,,,
7,do you have ever prank with friend and then that became a serious issue?,2,yes,yes,no,,
